{
    "name": "hlfv1",
    "x-type": "hlfv1",
    "x-commitTimeout": 300,
    "version": "1.0.0",
    "client": {
        "organization": "Org1",
        "connection": {
            "timeout": {
                "peer": {
                    "endorser": "300",
                    "eventHub": "300",
                    "eventReg": "300"
                },
                "orderer": "300"
            }
        }
    },
    "channels": {
        "composerchannel": {
            "orderers": [
                "orderer.example.com"
            ],
            "peers": {
                "peer0.org1.example.com": {
                    "endorsingPeer": true,
                    "chaincodeQuery": true,
                    "ledgerQuery": true,
                    "eventSource": true
                }
            }
        }
    },
    "organizations": {
        "Org1": {
            "mspid": "Org1MSP",
            "peers": [
                "peer0.org1.example.com"
            ],
            "certificateAuthorities": [
                "ca.org1.example.com"
            ]
        }
    },
    "orderers": {
        "orderer.example.com": {
            "url": "grpc://orderer.example.com:7050"
        }
    },
    "peers": {
        "peer0.org1.example.com": {
            "url": "grpc://peer0.org1.example.com:7051",
            "eventUrl": "grpc://peer0.org1.example.com:7053"
        }
    },
    "certificateAuthorities": {
        "ca.org1.example.com": {
            "url": "http://ca.org1.example.com:7054",
            "caName": "ca.org1.example.com"
        }
    }
}